{"generated_at":"2026-10-13T21:57:05+0000","season":2027,"as_of":"2026-10-10","rows":[{"team":"ÍA","short":"ÍA","played":2,"wins":2,"draws":0,"losses":0,"goals_for":217,"goals_against":151,"goal_diff":66,"points":4,"xg_for":null,"xg_against":null,"xpts":null,"goals_for_predicted":null,"goals_against_predicted":null,"points_predicted":null,"n_predicted_matches":0,"n_played_matches":2,"rank":1,"form":[null,null,null,"W","W"],"xg_trend":[],"xg_against_trend":[],"goals_trend":[106,111],"goals_against_trend":[77,74]},{"team":"Þór Þ.","short":"ÞÓR","played":2,"wins":2,"draws":0,"losses":0,"goals_for":224,"goals_against":180,"goal_diff":44,"points":4,"xg_for":null,"xg_against":null,"xpts":null,"goals_for_predicted":null,"goals_against_predicted":null,"points_predicted":null,"n_predicted_matches":0,"n_played_matches":2,"rank":2,"form":[null,null,null,"W","W"],"xg_trend":[],"xg_against_trend":[],"goals_trend":[121,103],"goals_against_trend":[82,98]},{"team":"Haukar","short":"HAU","played":2,"wins":2,"draws":0,"losses":0,"goals_for":220,"goals_against":185,"goal_diff":35,"points":4,"xg_for":null,"xg_against":null,"xpts":null,"goals_for_predicted":null,"goals_against_predicted":null,"points_predicted":null,"n_predicted_matches":0,"n_played_matches":2,"rank":3,"form":[null,null,null,"W","W"],"xg_trend":[],"xg_against_trend":[],"goals_trend":[117,103],"goals_against_trend":[90,95]},{"team":"KV","short":"KV","played":2,"wins":2,"draws":0,"losses":0,"goals_for":186,"goals_against":180,"goal_diff":6,"points":4,"xg_for":null,"xg_against":null,"xpts":null,"goals_for_predicted":null,"goals_against_predicted":null,"points_predicted":null,"n_predicted_matches":0,"n_played_matches":2,"rank":4,"form":[null,null,null,"W","W"],"xg_trend":[],"xg_against_trend":[],"goals_trend":[84,102],"goals_against_trend":[82,98]},{"team":"Breiðablik","short":"BRE","played":2,"wins":1,"draws":0,"losses":1,"goals_for":214,"goals_against":200,"goal_diff":14,"points":2,"xg_for":null,"xg_against":null,"xpts":null,"goals_for_predicted":null,"goals_against_predicted":null,"points_predicted":null,"n_predicted_matches":0,"n_played_matches":2,"rank":5,"form":[null,null,null,"L","W"],"xg_trend":[],"xg_against_trend":[],"goals_trend":[90,124],"goals_against_trend":[117,83]},{"team":"KFG","short":"KFG","played":2,"wins":1,"draws":0,"losses":1,"goals_for":195,"goals_against":185,"goal_diff":10,"points":2,"xg_for":null,"xg_against":null,"xpts":null,"goals_for_predicted":null,"goals_against_predicted":null,"points_predicted":null,"n_predicted_matches":0,"n_played_matches":2,"rank":6,"form":[null,null,null,"W","L"],"xg_trend":[],"xg_against_trend":[],"goals_trend":[97,98],"goals_against_trend":[82,103]},{"team":"Hamar","short":"HAM","played":2,"wins":1,"draws":0,"losses":1,"goals_for":189,"goals_against":198,"goal_diff":-9,"points":2,"xg_for":null,"xg_against":null,"xpts":null,"goals_for_predicted":null,"goals_against_predicted":null,"points_predicted":null,"n_predicted_matches":0,"n_played_matches":2,"rank":7,"form":[null,null,null,"L","W"],"xg_trend":[],"xg_against_trend":[],"goals_trend":[88,101],"goals_against_trend":[98,100]},{"team":"Fjölnir","short":"FJÖ","played":2,"wins":1,"draws":0,"losses":1,"goals_for":181,"goals_against":212,"goal_diff":-31,"points":2,"xg_for":null,"xg_against":null,"xpts":null,"goals_for_predicted":null,"goals_against_predicted":null,"points_predicted":null,"n_predicted_matches":0,"n_played_matches":2,"rank":8,"form":[null,null,null,"W","L"],"xg_trend":[],"xg_against_trend":[],"goals_trend":[98,83],"goals_against_trend":[88,124]},{"team":"Snæfell","short":"SNÆ","played":2,"wins":0,"draws":0,"losses":2,"goals_for":180,"goals_against":199,"goal_diff":-19,"points":0,"xg_for":null,"xg_against":null,"xpts":null,"goals_for_predicted":null,"goals_against_predicted":null,"points_predicted":null,"n_predicted_matches":0,"n_played_matches":2,"rank":9,"form":[null,null,null,"L","L"],"xg_trend":[],"xg_against_trend":[],"goals_trend":[82,98],"goals_against_trend":[97,102]},{"team":"Selfoss","short":"SEL","played":2,"wins":0,"draws":0,"losses":2,"goals_for":172,"goals_against":209,"goal_diff":-37,"points":0,"xg_for":null,"xg_against":null,"xpts":null,"goals_for_predicted":null,"goals_against_predicted":null,"points_predicted":null,"n_predicted_matches":0,"n_played_matches":2,"rank":10,"form":[null,null,null,"L","L"],"xg_trend":[],"xg_against_trend":[],"goals_trend":[77,95],"goals_against_trend":[106,103]},{"team":"Skallagrímur","short":"SKA","played":2,"wins":0,"draws":0,"losses":2,"goals_for":156,"goals_against":195,"goal_diff":-39,"points":0,"xg_for":null,"xg_against":null,"xpts":null,"goals_for_predicted":null,"goals_against_predicted":null,"points_predicted":null,"n_predicted_matches":0,"n_played_matches":2,"rank":11,"form":[null,null,null,"L","L"],"xg_trend":[],"xg_against_trend":[],"goals_trend":[82,74],"goals_against_trend":[84,111]},{"team":"Þór Ak.","short":"ÞÓR","played":2,"wins":0,"draws":0,"losses":2,"goals_for":182,"goals_against":222,"goal_diff":-40,"points":0,"xg_for":null,"xg_against":null,"xpts":null,"goals_for_predicted":null,"goals_against_predicted":null,"points_predicted":null,"n_predicted_matches":0,"n_played_matches":2,"rank":12,"form":[null,null,null,"L","L"],"xg_trend":[],"xg_against_trend":[],"goals_trend":[82,100],"goals_against_trend":[121,101]}]}
