{"generated_at":"2026-10-18T17:29:03+0000","season":2026,"as_of":"2026-09-12","rows":[{"team":"Haukar","short":"HAU","played":22,"wins":15,"draws":2,"losses":5,"goals_for":55,"goals_against":32,"goal_diff":23,"points":47,"xg_for":8.74975,"xg_against":8.68175,"xpts":6.96625,"goals_for_predicted":17,"goals_against_predicted":6,"points_predicted":12,"n_predicted_matches":5,"n_played_matches":22,"rank":1,"form":["W","W","W","L","L"],"xg_trend":[0.89225,1.9415,1.5195,2.19675,2.19975],"xg_against_trend":[1.42875,1.47625,2.459,2.02175,1.296],"goals_trend":[1,6,3,4,3],"goals_against_trend":[2,1,1,0,2]},{"team":"Selfoss","short":"SEL","played":22,"wins":13,"draws":6,"losses":3,"goals_for":55,"goals_against":36,"goal_diff":19,"points":45,"xg_for":11.06625,"xg_against":6.10325,"xpts":9.74775,"goals_for_predicted":10,"goals_against_predicted":9,"points_predicted":8,"n_predicted_matches":5,"n_played_matches":22,"rank":2,"form":["D","W","W","W","W"],"xg_trend":[1.9635,2.622,2.53075,1.47025,2.47975],"xg_against_trend":[0.41125,1.98475,1.0575,1.3545,1.29525],"goals_trend":[2,1,2,2,3],"goals_against_trend":[4,1,1,2,1]},{"team":"Kári","short":"KÁR","played":22,"wins":11,"draws":9,"losses":2,"goals_for":56,"goals_against":29,"goal_diff":27,"points":42,"xg_for":8.83075,"xg_against":10.35775,"xpts":6.22975,"goals_for_predicted":16,"goals_against_predicted":7,"points_predicted":10,"n_predicted_matches":5,"n_played_matches":22,"rank":3,"form":["D","W","W","W","W"],"xg_trend":[2.56,0.555,2.69125,1.4565,1.568],"xg_against_trend":[2.10975,2.63625,2.064,1.8815,1.66625],"goals_trend":[5,4,0,1,6],"goals_against_trend":[1,2,0,4,0]},{"team":"Dalvík/Reynir","short":"DAL","played":22,"wins":9,"draws":4,"losses":9,"goals_for":37,"goals_against":37,"goal_diff":0,"points":31,"xg_for":7.9165,"xg_against":8.333,"xpts":6.70175,"goals_for_predicted":5,"goals_against_predicted":12,"points_predicted":4,"n_predicted_matches":5,"n_played_matches":22,"rank":4,"form":["D","L","W","W","W"],"xg_trend":[2.20075,1.1385,1.5565,1.3545,1.66625],"xg_against_trend":[1.25425,2.316,1.7245,1.47025,1.568],"goals_trend":[1,1,1,2,0],"goals_against_trend":[0,2,2,2,6]},{"team":"Víkingur Ó.","short":"VÍK","played":22,"wins":9,"draws":4,"losses":9,"goals_for":33,"goals_against":41,"goal_diff":-8,"points":31,"xg_for":9.814,"xg_against":10.52175,"xpts":6.68525,"goals_for_predicted":7,"goals_against_predicted":14,"points_predicted":4,"n_predicted_matches":5,"n_played_matches":22,"rank":5,"form":["W","L","L","L","W"],"xg_trend":[2.8765,2.49475,1.7245,1.423,1.29525],"xg_against_trend":[2.26625,1.36825,1.5565,2.851,2.47975],"goals_trend":[3,0,2,1,1],"goals_against_trend":[3,2,1,5,3]},{"team":"Fjölnir","short":"FJÖ","played":22,"wins":8,"draws":6,"losses":8,"goals_for":49,"goals_against":46,"goal_diff":3,"points":30,"xg_for":13.42375,"xg_against":6.837,"xpts":10.46975,"goals_for_predicted":15,"goals_against_predicted":10,"points_predicted":9,"n_predicted_matches":5,"n_played_matches":22,"rank":6,"form":["L","L","D","D","W"],"xg_trend":[2.6955,2.316,2.459,2.851,3.10225],"xg_against_trend":[1.23525,1.1385,1.5195,1.423,1.52075],"goals_trend":[4,2,1,5,3],"goals_against_trend":[1,1,3,1,4]},{"team":"KFA","short":"KFA","played":22,"wins":9,"draws":2,"losses":11,"goals_for":51,"goals_against":45,"goal_diff":6,"points":29,"xg_for":7.56625,"xg_against":7.5305,"xpts":6.75375,"goals_for_predicted":12,"goals_against_predicted":11,"points_predicted":6,"n_predicted_matches":5,"n_played_matches":22,"rank":7,"form":["W","W","W","L","L"],"xg_trend":[0.41125,2.63625,0.8805,2.34225,1.296],"xg_against_trend":[1.9635,0.555,1.65775,1.1545,2.19975],"goals_trend":[4,2,0,4,2],"goals_against_trend":[2,4,2,0,3]},{"team":"Kormákur/Hvöt","short":"KOR","played":22,"wins":7,"draws":6,"losses":9,"goals_for":42,"goals_against":38,"goal_diff":4,"points":27,"xg_for":6.35725,"xg_against":10.33925,"xpts":4.75825,"goals_for_predicted":8,"goals_against_predicted":5,"points_predicted":7,"n_predicted_matches":5,"n_played_matches":22,"rank":8,"form":["L","L","L","W","L"],"xg_trend":[1.25425,1.36825,1.0575,1.8815,0.79575],"xg_against_trend":[2.20075,2.49475,2.53075,1.4565,1.6565],"goals_trend":[0,2,1,4,1],"goals_against_trend":[1,0,2,1,1]},{"team":"Magni","short":"MAG","played":22,"wins":7,"draws":4,"losses":11,"goals_for":35,"goals_against":54,"goal_diff":-19,"points":25,"xg_for":7.687,"xg_against":11.17525,"xpts":5.157,"goals_for_predicted":5,"goals_against_predicted":16,"points_predicted":4,"n_predicted_matches":5,"n_played_matches":22,"rank":9,"form":["D","W","L","L","L"],"xg_trend":[1.23525,1.47625,1.71875,1.1545,2.10225],"xg_against_trend":[2.6955,1.9415,2.458,2.34225,1.738],"goals_trend":[1,1,2,0,1],"goals_against_trend":[4,6,1,4,1]},{"team":"Þróttur V.","short":"ÞRÓ","played":22,"wins":7,"draws":2,"losses":13,"goals_for":33,"goals_against":42,"goal_diff":-9,"points":23,"xg_for":8.05225,"xg_against":6.269,"xpts":8.052,"goals_for_predicted":6,"goals_against_predicted":7,"points_predicted":7,"n_predicted_matches":5,"n_played_matches":22,"rank":10,"form":["L","L","L","D","W"],"xg_trend":[1.42875,1.78875,1.65775,1.5205,1.6565],"xg_against_trend":[0.89225,1.73275,0.8805,1.96775,0.79575],"goals_trend":[2,1,2,0,1],"goals_against_trend":[1,3,0,2,1]},{"team":"KFG","short":"KFG","played":22,"wins":7,"draws":1,"losses":14,"goals_for":38,"goals_against":58,"goal_diff":-20,"points":22,"xg_for":9.843,"xg_against":11.3665,"xpts":6.3365,"goals_for_predicted":9,"goals_against_predicted":15,"points_predicted":6,"n_predicted_matches":5,"n_played_matches":22,"rank":11,"form":["W","W","L","W","L"],"xg_trend":[2.10975,1.73275,2.458,2.02175,1.52075],"xg_against_trend":[2.56,1.78875,1.71875,2.19675,3.10225],"goals_trend":[1,3,1,0,4],"goals_against_trend":[5,1,2,4,3]},{"team":"Hvíti riddarinn","short":"HVÍ","played":22,"wins":3,"draws":8,"losses":11,"goals_for":28,"goals_against":54,"goal_diff":-26,"points":17,"xg_for":10.02075,"xg_against":11.8125,"xpts":6.135,"goals_for_predicted":7,"goals_against_predicted":5,"points_predicted":7,"n_predicted_matches":5,"n_played_matches":22,"rank":12,"form":["L","L","D","L","L"],"xg_trend":[2.26625,1.98475,2.064,1.96775,1.738],"xg_against_trend":[2.8765,2.622,2.69125,1.5205,2.10225],"goals_trend":[3,1,0,2,1],"goals_against_trend":[3,1,0,0,1]}]}
