{"generated_at":"2026-10-25T22:51:24+0000","season":2027,"as_of":"2026-10-18","rows":[{"team":"Afturelding","short":"AFT","played":6,"wins":6,"draws":0,"losses":0,"goals_for":174,"goals_against":137,"goal_diff":37,"points":12,"xg_for":130.20995,"xg_against":122.97461,"xpts":5.6985,"goals_for_predicted":148,"goals_against_predicted":119,"points_predicted":10,"n_predicted_matches":5,"n_played_matches":6,"rank":1,"form":["W","W","W","W","W"],"xg_trend":[21.97891,23.48042,29.47522,24.27387,31.00152],"xg_against_trend":[25.1371,25.28001,23.19421,25.23954,24.12374],"goals_trend":[27,30,29,30,32],"goals_against_trend":[24,26,22,25,22]},{"team":"FH","short":"FH","played":6,"wins":5,"draws":0,"losses":1,"goals_for":171,"goals_against":130,"goal_diff":41,"points":10,"xg_for":138.51782,"xg_against":109.91078,"xpts":7.57175,"goals_for_predicted":137,"goals_against_predicted":113,"points_predicted":8,"n_predicted_matches":5,"n_played_matches":6,"rank":2,"form":["L","W","W","W","W"],"xg_trend":[25.1371,32.22707,26.25429,28.43374,26.46563],"xg_against_trend":[21.97891,16.12998,23.87925,24.87036,23.05228],"goals_trend":[24,31,29,26,27],"goals_against_trend":[27,19,22,22,23]},{"team":"Víkingur","short":"VÍK","played":6,"wins":4,"draws":0,"losses":2,"goals_for":164,"goals_against":154,"goal_diff":10,"points":8,"xg_for":132.5001,"xg_against":113.4613,"xpts":6.74075,"goals_for_predicted":137,"goals_against_predicted":128,"points_predicted":6,"n_predicted_matches":5,"n_played_matches":6,"rank":3,"form":["W","W","W","L","L"],"xg_trend":[25.53876,29.87413,28.79539,25.23954,23.05228],"xg_against_trend":[18.42959,25.35804,18.93418,24.27387,26.46563],"goals_trend":[26,32,31,25,23],"goals_against_trend":[24,25,22,30,27]},{"team":"Fjölnir","short":"FJÖ","played":6,"wins":2,"draws":1,"losses":3,"goals_for":167,"goals_against":159,"goal_diff":8,"points":5,"xg_for":132.47289,"xg_against":122.76018,"xpts":6.01425,"goals_for_predicted":136,"goals_against_predicted":135,"points_predicted":3,"n_predicted_matches":5,"n_played_matches":6,"rank":4,"form":["W","L","L","D","L"],"xg_trend":[23.34758,25.28001,23.87925,30.91411,29.05194],"xg_against_trend":[28.33715,23.48042,26.25429,19.48667,25.20166],"goals_trend":[33,26,22,27,28],"goals_against_trend":[18,30,29,27,31]},{"team":"Fram 2","short":"FRA","played":6,"wins":2,"draws":0,"losses":4,"goals_for":156,"goals_against":156,"goal_diff":0,"points":4,"xg_for":137.38254,"xg_against":139.20055,"xpts":3.82025,"goals_for_predicted":130,"goals_against_predicted":129,"points_predicted":4,"n_predicted_matches":5,"n_played_matches":6,"rank":5,"form":["L","W","L","L","W"],"xg_trend":[27.85284,36.26346,23.19421,24.87036,25.20166],"xg_against_trend":[32.27581,19.96384,29.47522,28.43374,29.05194],"goals_trend":[27,28,22,22,31],"goals_against_trend":[28,18,29,26,28]},{"team":"Valur 2","short":"VAL","played":6,"wins":2,"draws":0,"losses":4,"goals_for":145,"goals_against":171,"goal_diff":-26,"points":4,"xg_for":143.26186,"xg_against":135.22598,"xpts":5.1965,"goals_for_predicted":121,"goals_against_predicted":140,"points_predicted":4,"n_predicted_matches":5,"n_played_matches":6,"rank":6,"form":["W","L","L","W","L"],"xg_trend":[32.27581,25.35804,27.22692,34.27735,24.12374],"xg_against_trend":[27.85284,29.87413,27.08985,19.40764,31.00152],"goals_trend":[28,25,20,26,22],"goals_against_trend":[27,32,27,22,32]},{"team":"HK 2","short":"HK2","played":6,"wins":1,"draws":1,"losses":4,"goals_for":145,"goals_against":161,"goal_diff":-16,"points":3,"xg_for":111.76918,"xg_against":131.40731,"xpts":3.45675,"goals_for_predicted":127,"goals_against_predicted":135,"points_predicted":3,"n_predicted_matches":5,"n_played_matches":6,"rank":7,"form":["L","L","W","D","L"],"xg_trend":[18.42959,16.12998,27.08985,19.48667,30.6331],"xg_against_trend":[25.53876,32.22707,27.22692,30.91411,15.50045],"goals_trend":[24,19,27,27,30],"goals_against_trend":[26,31,20,27,31]},{"team":"Grótta 2","short":"GRÓ","played":6,"wins":1,"draws":0,"losses":5,"goals_for":128,"goals_against":182,"goal_diff":-54,"points":2,"xg_for":102.14325,"xg_against":153.31687,"xpts":1.50125,"goals_for_predicted":111,"goals_against_predicted":148,"points_predicted":2,"n_predicted_matches":5,"n_played_matches":6,"rank":8,"form":["L","L","L","L","W"],"xg_trend":[28.33715,19.96384,18.93418,19.40764,15.50045],"xg_against_trend":[23.34758,36.26346,28.79539,34.27735,30.6331],"goals_trend":[18,18,22,22,31],"goals_against_trend":[33,28,31,26,30]}]}
