{"generated_at":"2026-10-20T11:37:10+0000","season":2027,"as_of":"2026-10-17","rows":[{"team":"Haukar","short":"HAU","played":6,"wins":6,"draws":0,"losses":0,"goals_for":211,"goals_against":175,"goal_diff":36,"points":12,"xg_for":163.45513,"xg_against":142.95428,"xpts":7.55425,"goals_for_predicted":173,"goals_against_predicted":146,"points_predicted":10,"n_predicted_matches":5,"n_played_matches":6,"rank":1,"form":["W","W","W","W","W"],"xg_trend":[30.87805,31.48408,30.07193,34.8194,36.20169],"xg_against_trend":[26.42701,27.74196,31.58154,28.81041,28.39336],"goals_trend":[37,32,35,38,31],"goals_against_trend":[31,30,34,29,22]},{"team":"Afturelding","short":"AFT","played":6,"wins":4,"draws":1,"losses":1,"goals_for":212,"goals_against":178,"goal_diff":34,"points":9,"xg_for":155.63635,"xg_against":150.50941,"xpts":5.5515,"goals_for_predicted":177,"goals_against_predicted":149,"points_predicted":7,"n_predicted_matches":5,"n_played_matches":6,"rank":2,"form":["D","L","W","W","W"],"xg_trend":[28.10175,27.74196,33.85879,31.63907,34.29477],"xg_against_trend":[29.74835,31.48408,28.62128,32.18924,28.46647],"goals_trend":[33,30,42,42,30],"goals_against_trend":[33,32,34,24,26]},{"team":"FH","short":"FH","played":6,"wins":4,"draws":1,"losses":1,"goals_for":217,"goals_against":192,"goal_diff":25,"points":9,"xg_for":163.33903,"xg_against":145.35249,"xpts":7.501,"goals_for_predicted":179,"goals_against_predicted":161,"points_predicted":7,"n_predicted_matches":5,"n_played_matches":6,"rank":3,"form":["D","W","L","W","W"],"xg_trend":[29.74835,33.5897,31.58154,34.967,33.45244],"xg_against_trend":[28.10175,27.09735,30.07193,29.74815,30.3333],"goals_trend":[33,40,34,36,36],"goals_against_trend":[33,34,35,31,28]},{"team":"KA","short":"KA","played":6,"wins":4,"draws":0,"losses":2,"goals_for":197,"goals_against":181,"goal_diff":16,"points":8,"xg_for":162.97417,"xg_against":159.50105,"xpts":5.60575,"goals_for_predicted":160,"goals_against_predicted":153,"points_predicted":6,"n_predicted_matches":5,"n_played_matches":6,"rank":4,"form":["W","L","W","W","L"],"xg_trend":[32.94541,33.52047,31.54268,33.6784,31.28721],"xg_against_trend":[31.8401,29.67242,36.37698,31.57176,30.03978],"goals_trend":[26,31,39,31,33],"goals_against_trend":[25,35,33,25,35]},{"team":"Valur","short":"VAL","played":6,"wins":4,"draws":0,"losses":2,"goals_for":226,"goals_against":211,"goal_diff":15,"points":8,"xg_for":178.68528,"xg_against":157.0895,"xpts":7.99075,"goals_for_predicted":192,"goals_against_predicted":181,"points_predicted":6,"n_predicted_matches":5,"n_played_matches":6,"rank":5,"form":["L","W","L","W","W"],"xg_trend":[34.90752,35.00748,36.37698,36.77806,35.61524],"xg_against_trend":[31.06419,30.5378,31.54268,31.23723,32.70759],"goals_trend":[40,38,33,40,41],"goals_against_trend":[47,29,39,35,31]},{"team":"ÍBV","short":"ÍBV","played":6,"wins":3,"draws":0,"losses":3,"goals_for":188,"goals_against":192,"goal_diff":-4,"points":6,"xg_for":133.71828,"xg_against":124.6732,"xpts":5.23875,"goals_for_predicted":126,"goals_against_predicted":124,"points_predicted":4,"n_predicted_matches":4,"n_played_matches":6,"rank":6,"form":["W","W","L","L","W"],"xg_trend":[34.81306,33.88136,31.57176,33.4521],"xg_against_trend":[30.28915,29.79216,33.6784,30.9135],"goals_trend":[30,34,25,37],"goals_against_trend":[27,35,31,31]},{"team":"Stjarnan","short":"STJ","played":6,"wins":2,"draws":1,"losses":3,"goals_for":199,"goals_against":206,"goal_diff":-7,"points":5,"xg_for":146.28105,"xg_against":156.47599,"xpts":3.51625,"goals_for_predicted":168,"goals_against_predicted":168,"points_predicted":5,"n_predicted_matches":5,"n_played_matches":6,"rank":7,"form":["L","D","W","L","W"],"xg_trend":[26.42701,29.81944,29.25232,30.7425,30.03978],"xg_against_trend":[30.87805,30.71427,32.58655,31.00991,31.28721],"goals_trend":[31,34,37,31,35],"goals_against_trend":[37,34,29,35,33]},{"team":"Þór","short":"ÞÓR","played":6,"wins":2,"draws":0,"losses":4,"goals_for":202,"goals_against":213,"goal_diff":-11,"points":4,"xg_for":154.42893,"xg_against":165.63957,"xpts":3.45425,"goals_for_predicted":168,"goals_against_predicted":175,"points_predicted":4,"n_predicted_matches":5,"n_played_matches":6,"rank":8,"form":["W","W","L","L","L"],"xg_trend":[31.06695,29.67242,31.53884,31.23723,30.9135],"xg_against_trend":[29.69853,33.52047,32.19041,36.77806,33.4521],"goals_trend":[36,35,31,35,31],"goals_against_trend":[31,31,36,40,37]},{"team":"HK","short":"HK","played":6,"wins":2,"draws":0,"losses":4,"goals_for":184,"goals_against":206,"goal_diff":-22,"points":4,"xg_for":149.50487,"xg_against":164.99305,"xpts":2.872,"goals_for_predicted":156,"goals_against_predicted":169,"points_predicted":4,"n_predicted_matches":5,"n_played_matches":6,"rank":9,"form":["L","L","W","W","L"],"xg_trend":[29.69853,30.5378,29.79216,31.00991,28.46647],"xg_against_trend":[31.06695,35.00748,33.88136,30.7425,34.29477],"goals_trend":[31,29,35,35,26],"goals_against_trend":[36,38,34,31,30]},{"team":"Fram","short":"FRA","played":6,"wins":2,"draws":0,"losses":4,"goals_for":196,"goals_against":222,"goal_diff":-26,"points":4,"xg_for":126.17327,"xg_against":129.25136,"xpts":3.5175,"goals_for_predicted":128,"goals_against_predicted":155,"points_predicted":2,"n_predicted_matches":4,"n_played_matches":6,"rank":10,"form":["W","L","L","L","L"],"xg_trend":[31.06419,32.58655,32.18924,30.3333],"xg_against_trend":[34.90752,29.25232,31.63907,33.45244],"goals_trend":[47,29,24,28],"goals_against_trend":[40,37,42,36]},{"team":"Víkingur","short":"VÍK","played":6,"wins":1,"draws":0,"losses":5,"goals_for":184,"goals_against":211,"goal_diff":-27,"points":2,"xg_for":152.64587,"xg_against":168.50858,"xpts":2.95425,"goals_for_predicted":155,"goals_against_predicted":176,"points_predicted":2,"n_predicted_matches":5,"n_played_matches":6,"rank":11,"form":["L","L","W","L","L"],"xg_trend":[31.8401,27.09735,32.19041,28.81041,32.70759],"xg_against_trend":[32.94541,33.5897,31.53884,34.8194,35.61524],"goals_trend":[25,34,36,29,31],"goals_against_trend":[26,40,31,38,41]},{"team":"Selfoss","short":"SEL","played":6,"wins":0,"draws":1,"losses":5,"goals_for":178,"goals_against":207,"goal_diff":-29,"points":1,"xg_for":147.76621,"xg_against":169.65998,"xpts":2.24375,"goals_for_predicted":148,"goals_against_predicted":173,"points_predicted":1,"n_predicted_matches":5,"n_played_matches":6,"rank":12,"form":["L","D","L","L","L"],"xg_trend":[30.28915,30.71427,28.62128,29.74815,28.39336],"xg_against_trend":[34.81306,29.81944,33.85879,34.967,36.20169],"goals_trend":[27,34,34,31,22],"goals_against_trend":[30,34,42,36,31]}]}
