{"generated_at":"2026-10-29T21:53:37+0000","season":2026,"as_of":"2026-09-12","rows":[{"team":"Grótta","short":"GRÓ","played":18,"wins":13,"draws":2,"losses":3,"goals_for":50,"goals_against":24,"goal_diff":26,"points":41,"xg_for":12.19575,"xg_against":8.72125,"xpts":8.8125,"goals_for_predicted":16,"goals_against_predicted":7,"points_predicted":12,"n_predicted_matches":5,"n_played_matches":18,"rank":1,"form":["W","W","W","W","L"],"xg_trend":[2.5665,2.04825,1.80975,2.91325,2.858],"xg_against_trend":[1,2.31775,2.2595,1.86925,1.27475],"goals_trend":[4,3,2,2,5],"goals_against_trend":[5,2,0,0,0]},{"team":"KR","short":"KR","played":18,"wins":11,"draws":2,"losses":5,"goals_for":52,"goals_against":23,"goal_diff":29,"points":35,"xg_for":12.88625,"xg_against":10.61075,"xpts":8.086,"goals_for_predicted":14,"goals_against_predicted":7,"points_predicted":12,"n_predicted_matches":5,"n_played_matches":18,"rank":2,"form":["W","L","W","W","W"],"xg_trend":[2.598,3.27625,2.3585,1.86925,2.78425],"xg_against_trend":[1.535,1.9625,1.5125,2.91325,2.6875],"goals_trend":[4,1,3,0,6],"goals_against_trend":[3,0,2,2,0]},{"team":"Haukar","short":"HAU","played":18,"wins":10,"draws":3,"losses":5,"goals_for":49,"goals_against":31,"goal_diff":18,"points":33,"xg_for":7.7015,"xg_against":12.347,"xpts":4.817,"goals_for_predicted":15,"goals_against_predicted":8,"points_predicted":15,"n_predicted_matches":5,"n_played_matches":18,"rank":3,"form":["W","W","L","W","W"],"xg_trend":[1,1.9485,1.308,2.0495,1.3955],"xg_against_trend":[2.5665,2.798,3.26375,1.3795,2.33925],"goals_trend":[5,2,2,3,3],"goals_against_trend":[4,0,1,1,2]},{"team":"HK","short":"HK","played":18,"wins":9,"draws":3,"losses":6,"goals_for":46,"goals_against":31,"goal_diff":15,"points":30,"xg_for":13.467,"xg_against":8.58625,"xpts":9.48625,"goals_for_predicted":7,"goals_against_predicted":13,"points_predicted":4,"n_predicted_matches":5,"n_played_matches":18,"rank":4,"form":["W","W","D","L","W"],"xg_trend":[2.77125,2.31775,3.26375,2.42675,2.6875],"xg_against_trend":[1.2145,2.04825,1.308,1.23125,2.78425],"goals_trend":[3,2,1,1,0],"goals_against_trend":[1,3,2,1,6]},{"team":"Selfoss","short":"SEL","played":18,"wins":9,"draws":3,"losses":6,"goals_for":33,"goals_against":26,"goal_diff":7,"points":30,"xg_for":8.82125,"xg_against":10.055,"xpts":6.39425,"goals_for_predicted":9,"goals_against_predicted":8,"points_predicted":7,"n_predicted_matches":5,"n_played_matches":18,"rank":5,"form":["D","W","L","W","D"],"xg_trend":[1.535,2.25,1.221,1.3795,2.43575],"xg_against_trend":[2.598,1.54925,2.58575,2.0495,1.2725],"goals_trend":[3,3,0,1,2],"goals_against_trend":[4,1,0,3,0]},{"team":"FHL","short":"FHL","played":18,"wins":7,"draws":4,"losses":7,"goals_for":35,"goals_against":28,"goal_diff":7,"points":25,"xg_for":11.64925,"xg_against":8.49825,"xpts":8.134,"goals_for_predicted":7,"goals_against_predicted":9,"points_predicted":4,"n_predicted_matches":5,"n_played_matches":18,"rank":6,"form":["D","W","W","L","D"],"xg_trend":[4.40375,1.4155,2.2595,1.23125,2.33925],"xg_against_trend":[1.07775,1.7885,1.80975,2.42675,1.3955],"goals_trend":[4,0,0,1,2],"goals_against_trend":[2,1,2,1,3]},{"team":"ÍA","short":"ÍA","played":18,"wins":7,"draws":3,"losses":8,"goals_for":35,"goals_against":30,"goal_diff":5,"points":24,"xg_for":8.21325,"xg_against":9.58675,"xpts":6.313,"goals_for_predicted":10,"goals_against_predicted":8,"points_predicted":6,"n_predicted_matches":5,"n_played_matches":18,"rank":7,"form":["W","L","L","L","W"],"xg_trend":[1.2145,1.7885,1.5125,2.583,1.11475],"xg_against_trend":[2.77125,1.4155,2.3585,1.19275,1.84875],"goals_trend":[1,1,2,5,1],"goals_against_trend":[3,0,3,0,2]},{"team":"Keflavík","short":"KEF","played":18,"wins":6,"draws":3,"losses":9,"goals_for":34,"goals_against":29,"goal_diff":5,"points":21,"xg_for":10.25325,"xg_against":7.482,"xpts":8.3995,"goals_for_predicted":11,"goals_against_predicted":8,"points_predicted":7,"n_predicted_matches":5,"n_played_matches":18,"rank":8,"form":["L","L","D","W","L"],"xg_trend":[1.24425,2.798,2.58575,1.7765,1.84875],"xg_against_trend":[1.88775,1.9485,1.221,1.31,1.11475],"goals_trend":[8,0,0,1,2],"goals_against_trend":[2,2,0,3,1]},{"team":"Völsungur","short":"VÖL","played":18,"wins":4,"draws":3,"losses":11,"goals_for":27,"goals_against":41,"goal_diff":-14,"points":15,"xg_for":7.04475,"xg_against":14.90275,"xpts":3.66125,"goals_for_predicted":8,"goals_against_predicted":8,"points_predicted":6,"n_predicted_matches":5,"n_played_matches":18,"rank":9,"form":["L","L","W","L","L"],"xg_trend":[1.07775,1.9625,1.422,1.31,1.2725],"xg_against_trend":[4.40375,3.27625,3.0105,1.7765,2.43575],"goals_trend":[2,0,3,3,0],"goals_against_trend":[4,1,0,1,2]},{"team":"Tindastóll","short":"TIN","played":18,"wins":1,"draws":0,"losses":17,"goals_for":10,"goals_against":108,"goal_diff":-98,"points":3,"xg_for":8.915,"xg_against":10.35725,"xpts":6.344,"goals_for_predicted":3,"goals_against_predicted":24,"points_predicted":0,"n_predicted_matches":5,"n_played_matches":18,"rank":10,"form":["L","L","L","L","L"],"xg_trend":[1.88775,1.54925,3.0105,1.19275,1.27475],"xg_against_trend":[1.24425,2.25,1.422,2.583,2.858],"goals_trend":[2,1,0,0,0],"goals_against_trend":[8,3,3,5,5]}]}
