{"generated_at":"2026-10-29T21:53:24+0000","season":2026,"as_of":"2026-10-24","rows":[{"team":"Víkingur R.","short":"VÍK","played":27,"wins":19,"draws":7,"losses":1,"goals_for":79,"goals_against":28,"goal_diff":51,"points":64,"xg_for":29.06225,"xg_against":13.005,"xpts":23.73775,"goals_for_predicted":36,"goals_against_predicted":8,"points_predicted":29,"n_predicted_matches":11,"n_played_matches":27,"rank":1,"form":["W","W","D","W","D"],"xg_trend":[2.39575,2.2485,2.56275,2.776,2.47375,3.72775,2.17625,3.4145,2.176,2.186,2.925],"xg_against_trend":[1.38025,1.52675,1.08525,1.0095,1.215,0.8495,0.9345,1.064,1.35875,1.503,1.0785],"goals_trend":[1,2,3,4,3,6,2,5,3,5,2],"goals_against_trend":[1,0,2,0,1,0,0,0,1,1,2]},{"team":"KR","short":"KR","played":27,"wins":17,"draws":5,"losses":5,"goals_for":93,"goals_against":58,"goal_diff":35,"points":56,"xg_for":31.4475,"xg_against":26.1765,"xpts":19.46725,"goals_for_predicted":49,"goals_against_predicted":28,"points_predicted":31,"n_predicted_matches":12,"n_played_matches":27,"rank":2,"form":["W","L","W","W","W"],"xg_trend":[3.12825,3.441,1.70175,2.98575,2.1905,2.55175,2.71525,1.7255,2.8235,2.69825,2.64725,2.83875],"xg_against_trend":[1.72625,1.736,2.1055,2.04925,3.1685,2.766,1.78125,2.70425,2.266,1.84775,2.045,1.98075],"goals_trend":[3,5,6,4,4,3,2,3,3,5,3,8],"goals_against_trend":[2,2,2,2,1,2,2,6,1,3,2,3]},{"team":"Fram","short":"FRA","played":27,"wins":13,"draws":8,"losses":6,"goals_for":64,"goals_against":55,"goal_diff":9,"points":47,"xg_for":17.111,"xg_against":18.857,"xpts":13.16625,"goals_for_predicted":27,"goals_against_predicted":18,"points_predicted":21,"n_predicted_matches":10,"n_played_matches":27,"rank":3,"form":["L","D","L","L","D"],"xg_trend":[1.95925,2.3585,1.428,1.8585,1.386,2.042,1.78125,1.4895,1.7295,1.0785],"xg_against_trend":[1.29475,1.27525,1.66975,1.23125,2.0995,1.823,2.71525,2.13825,1.685,2.925],"goals_trend":[3,3,0,5,4,3,2,1,4,2],"goals_against_trend":[3,1,1,1,3,2,2,0,3,2]},{"team":"ÍA","short":"ÍA","played":27,"wins":10,"draws":8,"losses":9,"goals_for":54,"goals_against":55,"goal_diff":-1,"points":38,"xg_for":15.6825,"xg_against":19.203,"xpts":12.2465,"goals_for_predicted":16,"goals_against_predicted":20,"points_predicted":13,"n_predicted_matches":10,"n_played_matches":27,"rank":4,"form":["L","W","D","W","D"],"xg_trend":[1.29475,1.1425,1.832,1.0095,1.34325,2.0455,1.38525,1.8215,1.5855,2.22275],"xg_against_trend":[1.95925,2.56075,1.66775,2.776,2.5525,1.22575,1.65025,1.21725,2.33775,1.25575],"goals_trend":[3,0,1,0,2,1,2,2,1,4],"goals_against_trend":[3,1,1,4,1,3,1,2,0,4]},{"team":"Breiðablik","short":"BRE","played":27,"wins":10,"draws":6,"losses":11,"goals_for":54,"goals_against":57,"goal_diff":-3,"points":36,"xg_for":21.17725,"xg_against":16.44525,"xpts":16.576,"goals_for_predicted":25,"goals_against_predicted":23,"points_predicted":15,"n_predicted_matches":10,"n_played_matches":27,"rank":5,"form":["W","L","W","L","L"],"xg_trend":[1.38025,2.56075,2.2215,2.884,1.66625,2.49775,1.59675,2.70425,1.685,1.98075],"xg_against_trend":[2.39575,1.1425,1.5805,0.9985,1.1225,1.11975,1.792,1.7255,1.7295,2.83875],"goals_trend":[1,1,0,4,2,3,2,6,3,3],"goals_against_trend":[1,0,0,0,1,3,3,3,4,8]},{"team":"Keflavík","short":"KEF","played":27,"wins":8,"draws":6,"losses":13,"goals_for":43,"goals_against":54,"goal_diff":-11,"points":30,"xg_for":17.368,"xg_against":24.2205,"xpts":11.68375,"goals_for_predicted":18,"goals_against_predicted":25,"points_predicted":12,"n_predicted_matches":11,"n_played_matches":27,"rank":6,"form":["L","D","L","L","D"],"xg_trend":[1.72625,1.27525,1.5805,1.3295,1.215,1.22575,1.794,2.576,1.345,2.045,1.25575],"xg_against_trend":[3.12825,2.3585,2.2215,2.47625,2.47375,2.0455,1.6485,1.281,1.71725,2.64725,2.22275],"goals_trend":[2,1,0,2,1,3,1,1,1,2,4],"goals_against_trend":[3,3,0,1,3,1,1,0,6,3,4]},{"team":"Stjarnan","short":"STJ","played":27,"wins":10,"draws":4,"losses":13,"goals_for":53,"goals_against":61,"goal_diff":-8,"points":34,"xg_for":22.90525,"xg_against":22.1305,"xpts":17.244,"goals_for_predicted":25,"goals_against_predicted":25,"points_predicted":13,"n_predicted_matches":12,"n_played_matches":27,"rank":7,"form":["W","L","L","L","W"],"xg_trend":[1.44625,2.2705,1.08525,2.337,2.5525,2.766,1.6485,2.13825,1.35875,1.5235,1.53175,2.247],"xg_against_trend":[1.9865,1.5015,2.56275,1.7545,1.34325,2.55175,1.794,1.4895,2.176,1.424,1.483,2.06375],"goals_trend":[3,3,2,2,1,2,1,0,1,3,1,6],"goals_against_trend":[2,2,3,4,2,3,1,1,3,1,3,0]},{"team":"Valur","short":"VAL","played":27,"wins":10,"draws":4,"losses":13,"goals_for":51,"goals_against":59,"goal_diff":-8,"points":34,"xg_for":26.69175,"xg_against":22.8875,"xpts":18.676,"goals_for_predicted":23,"goals_against_predicted":29,"points_predicted":18,"n_predicted_matches":12,"n_played_matches":27,"rank":8,"form":["W","D","L","W","L"],"xg_trend":[3.38425,2.2215,2.4675,1.7545,3.1685,1.823,1.792,1.86325,2.266,1.503,2.3845,2.06375],"xg_against_trend":[1.213,1.19125,1.5445,2.337,2.1905,2.042,1.59675,1.836,2.8235,2.186,1.68,2.247],"goals_trend":[1,2,3,4,1,2,3,1,1,1,4,0],"goals_against_trend":[2,1,0,2,4,3,2,0,3,5,1,6]},{"team":"FH","short":"FH","played":27,"wins":7,"draws":9,"losses":11,"goals_for":42,"goals_against":49,"goal_diff":-7,"points":30,"xg_for":17.853,"xg_against":20.896,"xpts":12.66975,"goals_for_predicted":13,"goals_against_predicted":28,"points_predicted":2,"n_predicted_matches":10,"n_played_matches":27,"rank":9,"form":["W","W","W","L","L"],"xg_trend":[1.3645,1.5015,1.5445,2.04925,2.0995,1.11975,2.17675,1.064,2.33775,2.5955],"xg_against_trend":[1.61025,2.2705,2.4675,2.98575,1.386,2.49775,1.70875,3.4145,1.5855,0.9695],"goals_trend":[1,2,0,2,3,3,1,0,0,1],"goals_against_trend":[1,3,3,4,4,3,2,5,1,2]},{"team":"Þór","short":"ÞÓR","played":27,"wins":9,"draws":3,"losses":15,"goals_for":29,"goals_against":59,"goal_diff":-30,"points":30,"xg_for":15.09925,"xg_against":26.11375,"xpts":10.2845,"goals_for_predicted":12,"goals_against_predicted":25,"points_predicted":12,"n_predicted_matches":11,"n_played_matches":27,"rank":10,"form":["L","L","W","W","W"],"xg_trend":[1.213,1.736,1.66975,0.9985,1.82475,0.8495,1.65025,1.281,1.424,1.483,0.9695],"xg_against_trend":[3.38425,3.441,1.428,2.884,1.63675,3.72775,1.38525,2.576,1.5235,1.53175,2.5955],"goals_trend":[2,2,1,0,0,0,1,0,1,3,2],"goals_against_trend":[1,5,0,4,1,6,2,1,3,1,1]},{"team":"KA","short":"KA","played":27,"wins":8,"draws":5,"losses":14,"goals_for":47,"goals_against":56,"goal_diff":-9,"points":29,"xg_for":20.0935,"xg_against":20.3605,"xpts":15.30125,"goals_for_predicted":18,"goals_against_predicted":20,"points_predicted":13,"n_predicted_matches":11,"n_played_matches":27,"rank":11,"form":["L","W","W","L","W"],"xg_trend":[1.9865,1.52675,1.66775,2.47625,1.63675,1.9935,1.70875,1.836,1.84775,1.68,1.7335],"xg_against_trend":[1.44625,2.2485,1.832,1.3295,1.82475,1.25525,2.17675,1.86325,2.69825,2.3845,1.3015],"goals_trend":[2,0,1,1,1,2,2,0,3,1,5],"goals_against_trend":[3,2,1,2,0,0,1,1,5,4,1]},{"team":"ÍBV","short":"ÍBV","played":27,"wins":5,"draws":7,"losses":15,"goals_for":37,"goals_against":55,"goal_diff":-18,"points":22,"xg_for":13.6865,"xg_against":17.88225,"xpts":11.387,"goals_for_predicted":15,"goals_against_predicted":28,"points_predicted":5,"n_predicted_matches":10,"n_played_matches":27,"rank":12,"form":["L","D","L","W","L"],"xg_trend":[1.61025,1.19125,2.1055,1.23125,1.1225,1.25525,0.9345,1.21725,1.71725,1.3015],"xg_against_trend":[1.3645,2.2215,1.70175,1.8585,1.66625,1.9935,2.17625,1.8215,1.345,1.7335],"goals_trend":[1,1,2,1,1,0,0,2,6,1],"goals_against_trend":[1,2,6,5,2,2,2,2,1,5]}]}
