{"generated_at":"2026-10-20T23:16:42+0000","season":2027,"as_of":"2026-10-16","rows":[{"team":"Álftanes","short":"ÁLF","played":2,"wins":2,"draws":0,"losses":0,"goals_for":230,"goals_against":165,"goal_diff":65,"points":4,"xg_for":null,"xg_against":null,"xpts":null,"goals_for_predicted":null,"goals_against_predicted":null,"points_predicted":null,"n_predicted_matches":0,"n_played_matches":2,"rank":1,"form":[null,null,null,"W","W"],"xg_trend":[],"xg_against_trend":[],"goals_trend":[111,119],"goals_against_trend":[77,88]},{"team":"Keflavík","short":"KEF","played":2,"wins":2,"draws":0,"losses":0,"goals_for":214,"goals_against":180,"goal_diff":34,"points":4,"xg_for":null,"xg_against":null,"xpts":null,"goals_for_predicted":null,"goals_against_predicted":null,"points_predicted":null,"n_predicted_matches":0,"n_played_matches":2,"rank":2,"form":[null,null,null,"W","W"],"xg_trend":[],"xg_against_trend":[],"goals_trend":[108,106],"goals_against_trend":[90,90]},{"team":"Tindastóll","short":"TIN","played":2,"wins":2,"draws":0,"losses":0,"goals_for":194,"goals_against":163,"goal_diff":31,"points":4,"xg_for":null,"xg_against":null,"xpts":null,"goals_for_predicted":null,"goals_against_predicted":null,"points_predicted":null,"n_predicted_matches":0,"n_played_matches":2,"rank":3,"form":[null,null,null,"W","W"],"xg_trend":[],"xg_against_trend":[],"goals_trend":[85,109],"goals_against_trend":[77,86]},{"team":"KR","short":"KR","played":2,"wins":2,"draws":0,"losses":0,"goals_for":175,"goals_against":153,"goal_diff":22,"points":4,"xg_for":null,"xg_against":null,"xpts":null,"goals_for_predicted":null,"goals_against_predicted":null,"points_predicted":null,"n_predicted_matches":0,"n_played_matches":2,"rank":4,"form":[null,null,null,"W","W"],"xg_trend":[],"xg_against_trend":[],"goals_trend":[91,84],"goals_against_trend":[80,73]},{"team":"Valur","short":"VAL","played":2,"wins":2,"draws":0,"losses":0,"goals_for":171,"goals_against":151,"goal_diff":20,"points":4,"xg_for":null,"xg_against":null,"xpts":null,"goals_for_predicted":null,"goals_against_predicted":null,"points_predicted":null,"n_predicted_matches":0,"n_played_matches":2,"rank":5,"form":[null,null,null,"W","W"],"xg_trend":[],"xg_against_trend":[],"goals_trend":[90,81],"goals_against_trend":[77,74]},{"team":"ÍR","short":"ÍR","played":2,"wins":1,"draws":0,"losses":1,"goals_for":185,"goals_against":210,"goal_diff":-25,"points":2,"xg_for":null,"xg_against":null,"xpts":null,"goals_for_predicted":null,"goals_against_predicted":null,"points_predicted":null,"n_predicted_matches":0,"n_played_matches":2,"rank":6,"form":[null,null,null,"W","L"],"xg_trend":[],"xg_against_trend":[],"goals_trend":[97,88],"goals_against_trend":[91,119]},{"team":"Höttur","short":"HÖT","played":2,"wins":1,"draws":0,"losses":1,"goals_for":180,"goals_against":209,"goal_diff":-29,"points":2,"xg_for":null,"xg_against":null,"xpts":null,"goals_for_predicted":null,"goals_against_predicted":null,"points_predicted":null,"n_predicted_matches":0,"n_played_matches":2,"rank":7,"form":[null,null,null,"L","W"],"xg_trend":[],"xg_against_trend":[],"goals_trend":[77,103],"goals_against_trend":[111,98]},{"team":"Stjarnan","short":"STJ","played":2,"wins":0,"draws":0,"losses":2,"goals_for":175,"goals_against":193,"goal_diff":-18,"points":0,"xg_for":null,"xg_against":null,"xpts":null,"goals_for_predicted":null,"goals_against_predicted":null,"points_predicted":null,"n_predicted_matches":0,"n_played_matches":2,"rank":8,"form":[null,null,null,"L","L"],"xg_trend":[],"xg_against_trend":[],"goals_trend":[77,98],"goals_against_trend":[90,103]},{"team":"Grindavík","short":"GRI","played":2,"wins":0,"draws":0,"losses":2,"goals_for":154,"goals_against":172,"goal_diff":-18,"points":0,"xg_for":null,"xg_against":null,"xpts":null,"goals_for_predicted":null,"goals_against_predicted":null,"points_predicted":null,"n_predicted_matches":0,"n_played_matches":2,"rank":9,"form":[null,null,null,"L","L"],"xg_trend":[],"xg_against_trend":[],"goals_trend":[80,74],"goals_against_trend":[91,81]},{"team":"Njarðvík","short":"NJA","played":2,"wins":0,"draws":0,"losses":2,"goals_for":150,"goals_against":169,"goal_diff":-19,"points":0,"xg_for":null,"xg_against":null,"xpts":null,"goals_for_predicted":null,"goals_against_predicted":null,"points_predicted":null,"n_predicted_matches":0,"n_played_matches":2,"rank":10,"form":[null,null,null,"L","L"],"xg_trend":[],"xg_against_trend":[],"goals_trend":[77,73],"goals_against_trend":[85,84]},{"team":"Sindri","short":"SIN","played":2,"wins":0,"draws":0,"losses":2,"goals_for":181,"goals_against":203,"goal_diff":-22,"points":0,"xg_for":null,"xg_against":null,"xpts":null,"goals_for_predicted":null,"goals_against_predicted":null,"points_predicted":null,"n_predicted_matches":0,"n_played_matches":2,"rank":11,"form":[null,null,null,"L","L"],"xg_trend":[],"xg_against_trend":[],"goals_trend":[91,90],"goals_against_trend":[97,106]},{"team":"Ármann","short":"ÁRM","played":2,"wins":0,"draws":0,"losses":2,"goals_for":176,"goals_against":217,"goal_diff":-41,"points":0,"xg_for":null,"xg_against":null,"xpts":null,"goals_for_predicted":null,"goals_against_predicted":null,"points_predicted":null,"n_predicted_matches":0,"n_played_matches":2,"rank":12,"form":[null,null,null,"L","L"],"xg_trend":[],"xg_against_trend":[],"goals_trend":[90,86],"goals_against_trend":[108,109]}]}
