{"generated_at":"2026-10-23T18:49:06+0000","season":2026,"as_of":"2026-09-12","rows":[{"team":"Víðir","short":"VÍÐ","played":22,"wins":14,"draws":4,"losses":4,"goals_for":60,"goals_against":26,"goal_diff":34,"points":46,"xg_for":9.7965,"xg_against":6.85325,"xpts":8.60225,"goals_for_predicted":10,"goals_against_predicted":7,"points_predicted":10,"n_predicted_matches":5,"n_played_matches":22,"rank":1,"form":["W","W","L","W","D"],"xg_trend":[1.4225,2.19625,1.8415,1.645,2.69125],"xg_against_trend":[1.99,1.486,1.13325,1.2345,1.0095],"goals_trend":[1,4,0,2,3],"goals_against_trend":[1,3,1,1,1]},{"team":"KH","short":"KH","played":22,"wins":13,"draws":5,"losses":4,"goals_for":65,"goals_against":30,"goal_diff":35,"points":44,"xg_for":10.89575,"xg_against":11.76425,"xpts":6.689,"goals_for_predicted":18,"goals_against_predicted":8,"points_predicted":10,"n_predicted_matches":5,"n_played_matches":22,"rank":2,"form":["D","W","L","W","W"],"xg_trend":[1.87775,1.486,2.81025,2.0195,2.70225],"xg_against_trend":[1.804,2.19625,2.07275,3.61625,2.075],"goals_trend":[6,3,2,4,3],"goals_against_trend":[1,4,2,1,0]},{"team":"Reynir S.","short":"REY","played":22,"wins":13,"draws":3,"losses":6,"goals_for":61,"goals_against":42,"goal_diff":19,"points":42,"xg_for":10.95125,"xg_against":8.39925,"xpts":8.416,"goals_for_predicted":10,"goals_against_predicted":9,"points_predicted":9,"n_predicted_matches":5,"n_played_matches":22,"rank":3,"form":["D","L","W","L","W"],"xg_trend":[2.777,1.36175,2.40075,3.067,1.34475],"xg_against_trend":[1.425,1.01575,1.26275,1.822,2.87375],"goals_trend":[3,1,2,3,1],"goals_against_trend":[1,4,0,2,2]},{"team":"Tindastóll","short":"TIN","played":22,"wins":13,"draws":3,"losses":6,"goals_for":54,"goals_against":39,"goal_diff":15,"points":42,"xg_for":13.6775,"xg_against":7.61475,"xpts":9.91075,"goals_for_predicted":13,"goals_against_predicted":4,"points_predicted":13,"n_predicted_matches":5,"n_played_matches":22,"rank":4,"form":["D","W","W","L","D"],"xg_trend":[3.12575,2.80125,3.423,1.45375,2.87375],"xg_against_trend":[1.48775,2.00975,1.127,1.6455,1.34475],"goals_trend":[5,3,3,0,2],"goals_against_trend":[1,1,1,0,1]},{"team":"KV","short":"KV","played":22,"wins":9,"draws":3,"losses":10,"goals_for":53,"goals_against":65,"goal_diff":-12,"points":30,"xg_for":12.5735,"xg_against":12.63025,"xpts":6.989,"goals_for_predicted":15,"goals_against_predicted":13,"points_predicted":9,"n_predicted_matches":5,"n_played_matches":22,"rank":5,"form":["L","L","D","L","L"],"xg_trend":[2.901,2.2,2.9795,1.822,2.671],"xg_against_trend":[3.054,3.07775,1.6195,3.067,1.812],"goals_trend":[3,3,2,2,5],"goals_against_trend":[2,4,1,3,3]},{"team":"Höttur","short":"HÖT","played":22,"wins":7,"draws":8,"losses":7,"goals_for":34,"goals_against":36,"goal_diff":-2,"points":29,"xg_for":8.1255,"xg_against":9.34025,"xpts":6.33,"goals_for_predicted":5,"goals_against_predicted":6,"points_predicted":5,"n_predicted_matches":5,"n_played_matches":22,"rank":6,"form":["L","L","D","W","W"],"xg_trend":[2.9615,1.01575,1.6195,1.6455,0.88325],"xg_against_trend":[1.21475,1.36175,2.9795,1.45375,2.3305],"goals_trend":[0,4,1,0,0],"goals_against_trend":[0,1,2,0,3]},{"team":"Sindri","short":"SIN","played":22,"wins":8,"draws":4,"losses":10,"goals_for":40,"goals_against":46,"goal_diff":-6,"points":28,"xg_for":8.20625,"xg_against":8.76625,"xpts":6.63925,"goals_for_predicted":4,"goals_against_predicted":14,"points_predicted":4,"n_predicted_matches":5,"n_played_matches":22,"rank":7,"form":["W","W","D","W","D"],"xg_trend":[1.804,2.01175,1.13325,1.18275,2.0745],"xg_against_trend":[1.87775,1.4195,1.8415,1.96975,1.65775],"goals_trend":[1,1,1,0,1],"goals_against_trend":[6,1,0,4,3]},{"team":"KF","short":"KF","played":22,"wins":6,"draws":9,"losses":7,"goals_for":31,"goals_against":38,"goal_diff":-7,"points":27,"xg_for":6.9435,"xg_against":11.69,"xpts":4.5685,"goals_for_predicted":5,"goals_against_predicted":10,"points_predicted":2,"n_predicted_matches":5,"n_played_matches":22,"rank":8,"form":["D","W","L","D","L"],"xg_trend":[1.21475,1.4195,1.26275,1.2345,1.812],"xg_against_trend":[2.9615,2.01175,2.40075,1.645,2.671],"goals_trend":[0,1,0,1,3],"goals_against_trend":[0,1,2,2,5]},{"team":"Ýmir","short":"ÝMI","played":22,"wins":7,"draws":5,"losses":10,"goals_for":41,"goals_against":46,"goal_diff":-5,"points":26,"xg_for":8.23125,"xg_against":11.1815,"xpts":5.6905,"goals_for_predicted":8,"goals_against_predicted":13,"points_predicted":4,"n_predicted_matches":5,"n_played_matches":22,"rank":9,"form":["L","W","D","W","W"],"xg_trend":[1.48775,1.6915,2.07275,1.96975,1.0095],"xg_against_trend":[3.12575,1.3715,2.81025,1.18275,2.69125],"goals_trend":[1,0,2,4,1],"goals_against_trend":[5,3,2,0,3]},{"team":"Augnablik","short":"AUG","played":22,"wins":7,"draws":4,"losses":11,"goals_for":37,"goals_against":47,"goal_diff":-10,"points":25,"xg_for":10.76325,"xg_against":7.14525,"xpts":8.80475,"goals_for_predicted":12,"goals_against_predicted":8,"points_predicted":8,"n_predicted_matches":5,"n_played_matches":22,"rank":10,"form":["W","L","W","L","D"],"xg_trend":[1.99,1.3715,3.11225,1.959,2.3305],"xg_against_trend":[1.4225,1.6915,1.204,1.944,0.88325],"goals_trend":[1,3,2,3,3],"goals_against_trend":[1,0,4,3,0]},{"team":"KÁ","short":"KÁ","played":22,"wins":7,"draws":1,"losses":14,"goals_for":39,"goals_against":68,"goal_diff":-29,"points":22,"xg_for":11.54175,"xg_against":12.9085,"xpts":6.3335,"goals_for_predicted":11,"goals_against_predicted":13,"points_predicted":6,"n_predicted_matches":5,"n_played_matches":22,"rank":11,"form":["W","L","W","L","L"],"xg_trend":[3.054,2.00975,1.204,3.61625,1.65775],"xg_against_trend":[2.901,2.80125,3.11225,2.0195,2.0745],"goals_trend":[2,1,4,1,3],"goals_against_trend":[3,3,2,4,1]},{"team":"Árbær","short":"ÁRB","played":22,"wins":2,"draws":3,"losses":17,"goals_for":33,"goals_against":65,"goal_diff":-32,"points":9,"xg_for":9.64875,"xg_against":13.06125,"xpts":5.411,"goals_for_predicted":9,"goals_against_predicted":15,"points_predicted":4,"n_predicted_matches":5,"n_played_matches":22,"rank":12,"form":["L","L","L","D","L"],"xg_trend":[1.425,3.07775,1.127,1.944,2.075],"xg_against_trend":[2.777,2.2,3.423,1.959,2.70225],"goals_trend":[1,4,1,3,0],"goals_against_trend":[3,3,3,3,3]}]}
