{"generated_at":"2026-10-25T17:54:08+0000","season":2026,"as_of":"2026-09-05","rows":[{"team":"Afturelding","short":"AFT","played":22,"wins":14,"draws":3,"losses":5,"goals_for":65,"goals_against":33,"goal_diff":32,"points":45,"xg_for":15.5195,"xg_against":9.728,"xpts":12.82725,"goals_for_predicted":22,"goals_against_predicted":13,"points_predicted":16,"n_predicted_matches":7,"n_played_matches":22,"rank":1,"form":["D","W","W","W","L"],"xg_trend":[2.1025,3.55875,1.55075,2.0185,2.12,2.39225,1.77675],"xg_against_trend":[1.1175,1.22525,1.316,1.658,1.4335,1.646,1.33175],"goals_trend":[4,0,3,3,4,3,5],"goals_against_trend":[7,0,0,1,3,1,1]},{"team":"Þróttur R.","short":"ÞRÓ","played":22,"wins":13,"draws":4,"losses":5,"goals_for":50,"goals_against":25,"goal_diff":25,"points":43,"xg_for":14.1195,"xg_against":10.22875,"xpts":12.043,"goals_for_predicted":16,"goals_against_predicted":9,"points_predicted":13,"n_predicted_matches":7,"n_played_matches":22,"rank":2,"form":["L","W","L","W","W"],"xg_trend":[1.85925,1.92325,2.1035,1.99625,1.4335,2.27475,2.529],"xg_against_trend":[1.61625,1.6415,1.391,0.9565,2.12,1.1425,1.361],"goals_trend":[2,3,3,1,3,2,2],"goals_against_trend":[0,1,0,1,4,3,0]},{"team":"Fylkir","short":"FYL","played":22,"wins":13,"draws":1,"losses":8,"goals_for":49,"goals_against":36,"goal_diff":13,"points":40,"xg_for":11.2415,"xg_against":7.78275,"xpts":10.2605,"goals_for_predicted":10,"goals_against_predicted":8,"points_predicted":12,"n_predicted_matches":6,"n_played_matches":22,"rank":3,"form":["D","L","W","W","L"],"xg_trend":[2.90125,1.0885,2.086,1.9355,1.8985,1.33175],"xg_against_trend":[1.32225,1.483,1.26125,1.1,0.8395,1.77675],"goals_trend":[3,0,2,1,3,1],"goals_against_trend":[0,2,1,0,0,5]},{"team":"HK","short":"HK","played":22,"wins":12,"draws":2,"losses":8,"goals_for":52,"goals_against":40,"goal_diff":12,"points":38,"xg_for":16.167,"xg_against":9.68525,"xpts":12.9755,"goals_for_predicted":14,"goals_against_predicted":13,"points_predicted":12,"n_predicted_matches":7,"n_played_matches":22,"rank":4,"form":["W","D","W","L","W"],"xg_trend":[2.49475,3.50775,1.37825,2.09475,1.81925,3.24575,1.6265],"xg_against_trend":[0.938,1.26825,1.524,1.4025,2.12675,1.0235,1.40225],"goals_trend":[4,2,3,2,1,1,1],"goals_against_trend":[1,1,4,0,3,0,4]},{"team":"Njarðvík","short":"NJA","played":22,"wins":12,"draws":2,"losses":8,"goals_for":38,"goals_against":29,"goal_diff":9,"points":38,"xg_for":12.594,"xg_against":10.06325,"xpts":11.1815,"goals_for_predicted":6,"goals_against_predicted":6,"points_predicted":8,"n_predicted_matches":7,"n_played_matches":22,"rank":5,"form":["W","L","W","L","W"],"xg_trend":[1.61625,2.05125,1.483,1.4025,2.589,1.30575,2.14625],"xg_against_trend":[1.85925,1.563,1.0885,2.09475,1.034,1.44425,0.9795],"goals_trend":[0,0,2,0,0,3,1],"goals_against_trend":[2,0,0,2,0,0,2]},{"team":"Leiknir R.","short":"LEI","played":22,"wins":8,"draws":4,"losses":10,"goals_for":34,"goals_against":33,"goal_diff":1,"points":28,"xg_for":8.75925,"xg_against":11.35775,"xpts":8.03825,"goals_for_predicted":8,"goals_against_predicted":10,"points_predicted":9,"n_predicted_matches":7,"n_played_matches":22,"rank":6,"form":["L","W","L","W","L"],"xg_trend":[1.4215,1.135,1.316,0.9565,1.6885,0.8395,1.40225],"xg_against_trend":[1.56675,1.343,1.55075,1.99625,1.376,1.8985,1.6265],"goals_trend":[1,2,0,1,0,0,4],"goals_against_trend":[1,1,3,1,0,3,1]},{"team":"ÍR","short":"ÍR","played":22,"wins":8,"draws":4,"losses":10,"goals_for":40,"goals_against":46,"goal_diff":-6,"points":28,"xg_for":12.71375,"xg_against":12.117,"xpts":10.024,"goals_for_predicted":15,"goals_against_predicted":17,"points_predicted":7,"n_predicted_matches":7,"n_played_matches":22,"rank":7,"form":["L","W","W","L","W"],"xg_trend":[1.1175,1.6415,2.7785,1.26125,2.12675,2.0605,1.72775],"xg_against_trend":[2.1025,1.92325,1.4245,2.086,1.81925,1.53075,1.23075],"goals_trend":[7,1,2,1,3,1,0],"goals_against_trend":[4,3,2,2,1,4,1]},{"team":"Grótta","short":"GRÓ","played":22,"wins":8,"draws":3,"losses":11,"goals_for":36,"goals_against":43,"goal_diff":-7,"points":27,"xg_for":9.156,"xg_against":13.392,"xpts":7.3865,"goals_for_predicted":14,"goals_against_predicted":15,"points_predicted":12,"n_predicted_matches":7,"n_played_matches":22,"rank":8,"form":["D","L","L","L","L"],"xg_trend":[0.938,1.343,1.618,1.658,1.477,1.1425,0.9795],"xg_against_trend":[2.49475,1.135,1.93725,2.0185,1.3855,2.27475,2.14625],"goals_trend":[1,1,1,1,5,3,2],"goals_against_trend":[4,2,0,3,3,2,1]},{"team":"Vestri","short":"VES","played":22,"wins":8,"draws":3,"losses":11,"goals_for":30,"goals_against":43,"goal_diff":-13,"points":27,"xg_for":9.37225,"xg_against":8.38925,"xpts":8.83025,"goals_for_predicted":11,"goals_against_predicted":13,"points_predicted":10,"n_predicted_matches":6,"n_played_matches":22,"rank":9,"form":["W","L","W","L","L"],"xg_trend":[2.22075,1.524,1.567,1.3855,1.44425,1.23075],"xg_against_trend":[1.16525,1.37825,1.33525,1.477,1.30575,1.72775],"goals_trend":[1,4,2,3,0,1],"goals_against_trend":[1,3,1,5,3,0]},{"team":"Völsungur","short":"VÖL","played":22,"wins":7,"draws":5,"losses":10,"goals_for":32,"goals_against":44,"goal_diff":-12,"points":26,"xg_for":9.64925,"xg_against":16.414,"xpts":6.48925,"goals_for_predicted":4,"goals_against_predicted":12,"points_predicted":2,"n_predicted_matches":7,"n_played_matches":22,"rank":10,"form":["W","W","L","W","W"],"xg_trend":[1.56675,1.22525,1.391,1.44175,1.1,1.0235,1.901],"xg_against_trend":[1.4215,3.55875,2.1035,2.438,1.9355,3.24575,1.711],"goals_trend":[1,0,0,1,0,0,2],"goals_against_trend":[1,0,3,3,1,1,3]},{"team":"Grindavík","short":"GRI","played":22,"wins":5,"draws":10,"losses":7,"goals_for":25,"goals_against":35,"goal_diff":-10,"points":25,"xg_for":10.97375,"xg_against":15.102,"xpts":7.539,"goals_for_predicted":7,"goals_against_predicted":9,"points_predicted":7,"n_predicted_matches":7,"n_played_matches":22,"rank":11,"form":["W","D","L","W","D"],"xg_trend":[1.16525,1.563,1.4245,2.438,1.376,1.646,1.361],"xg_against_trend":[2.22075,2.05125,2.7785,1.44175,1.6885,2.39225,2.529],"goals_trend":[1,0,2,3,0,1,0],"goals_against_trend":[1,0,2,1,0,3,2]},{"team":"Ægir","short":"ÆGI","played":22,"wins":2,"draws":3,"losses":17,"goals_for":25,"goals_against":69,"goal_diff":-44,"points":9,"xg_for":10.13875,"xg_against":16.1445,"xpts":6.866,"goals_for_predicted":9,"goals_against_predicted":11,"points_predicted":7,"n_predicted_matches":7,"n_played_matches":22,"rank":12,"form":["L","L","L","L","D"],"xg_trend":[1.32225,1.26825,1.93725,1.33525,1.034,1.53075,1.711],"xg_against_trend":[2.90125,3.50775,1.618,1.567,2.589,2.0605,1.901],"goals_trend":[0,1,0,1,0,4,3],"goals_against_trend":[3,2,1,2,0,1,2]}]}
