{"generated_at":"2026-10-30T14:51:11+0000","season":2027,"as_of":"2026-10-25","rows":[{"team":"Grótta","short":"GRÓ","played":7,"wins":7,"draws":0,"losses":0,"goals_for":256,"goals_against":171,"goal_diff":85,"points":14,"xg_for":172.72797,"xg_against":146.80556,"xpts":8.013,"goals_for_predicted":174,"goals_against_predicted":117,"points_predicted":10,"n_predicted_matches":5,"n_played_matches":7,"rank":1,"form":["W","W","W","W","W"],"xg_trend":[26.66883,37.63554,34.65846,36.82617,36.93897],"xg_against_trend":[36.36303,29.28226,25.72212,27.69443,27.74372],"goals_trend":[33,38,36,33,34],"goals_against_trend":[19,24,21,23,30]},{"team":"ÍR","short":"ÍR","played":7,"wins":7,"draws":0,"losses":0,"goals_for":259,"goals_against":185,"goal_diff":74,"points":14,"xg_for":224.00877,"xg_against":177.29125,"xpts":10.67725,"goals_for_predicted":225,"goals_against_predicted":163,"points_predicted":12,"n_predicted_matches":6,"n_played_matches":7,"rank":2,"form":["W","W","W","W","W"],"xg_trend":[33.64596,41.79806,35.32206,41.57761,34.73607,36.929],"xg_against_trend":[28.26386,32.86625,31.14765,25.84752,28.58059,30.58539],"goals_trend":[32,47,29,43,41,33],"goals_against_trend":[30,37,19,22,32,23]},{"team":"Selfoss 2","short":"SEL","played":7,"wins":6,"draws":0,"losses":1,"goals_for":249,"goals_against":225,"goal_diff":24,"points":12,"xg_for":175.02264,"xg_against":175.58838,"xpts":5.07425,"goals_for_predicted":187,"goals_against_predicted":169,"points_predicted":8,"n_predicted_matches":5,"n_played_matches":7,"rank":3,"form":["L","W","W","W","W"],"xg_trend":[34.12784,32.86625,33.96051,36.15493,37.91312],"xg_against_trend":[34.65177,41.79806,33.13956,35.05814,30.94085],"goals_trend":[36,37,38,36,40],"goals_against_trend":[29,47,29,26,38]},{"team":"Haukar 2","short":"HAU","played":6,"wins":3,"draws":2,"losses":1,"goals_for":178,"goals_against":179,"goal_diff":-1,"points":8,"xg_for":154.58005,"xg_against":154.0352,"xpts":5.2425,"goals_for_predicted":150,"goals_against_predicted":151,"points_predicted":7,"n_predicted_matches":5,"n_played_matches":6,"rank":4,"form":["W","W","D","W","L"],"xg_trend":[29.20968,32.0937,30.82561,34.75664,27.69443],"xg_against_trend":[32.40676,24.01309,32.35691,28.43227,36.82617],"goals_trend":[34,34,31,28,23],"goals_against_trend":[30,30,31,27,33]},{"team":"Hörður","short":"HÖR","played":7,"wins":4,"draws":0,"losses":3,"goals_for":188,"goals_against":216,"goal_diff":-28,"points":8,"xg_for":156.30055,"xg_against":152.6896,"xpts":5.375,"goals_for_predicted":137,"goals_against_predicted":157,"points_predicted":6,"n_predicted_matches":5,"n_played_matches":7,"rank":5,"form":["W","W","W","L","W"],"xg_trend":[34.65177,29.80643,31.25959,31.37776,29.205],"xg_against_trend":[34.12784,30.31164,30.17965,26.14252,31.92796],"goals_trend":[29,25,33,31,19],"goals_against_trend":[36,23,32,30,36]},{"team":"Valur 2","short":"VAL","played":7,"wins":3,"draws":1,"losses":3,"goals_for":196,"goals_against":200,"goal_diff":-4,"points":7,"xg_for":190.19177,"xg_against":178.41908,"xpts":6.873,"goals_for_predicted":168,"goals_against_predicted":172,"points_predicted":6,"n_predicted_matches":6,"n_played_matches":7,"rank":6,"form":["L","L","L","W","W"],"xg_trend":[33.91013,30.31164,31.14765,33.13956,26.10338,35.57942],"xg_against_trend":[27.67948,29.80643,35.32206,33.96051,27.56414,24.08645],"goals_trend":[30,23,19,29,38,29],"goals_against_trend":[28,25,29,38,28,24]},{"team":"HK 2","short":"HK2","played":7,"wins":3,"draws":0,"losses":4,"goals_for":215,"goals_against":205,"goal_diff":10,"points":6,"xg_for":179.0403,"xg_against":195.19867,"xpts":3.75,"goals_for_predicted":186,"goals_against_predicted":175,"points_predicted":6,"n_predicted_matches":6,"n_played_matches":7,"rank":7,"form":["W","L","W","W","L"],"xg_trend":[27.67948,36.94895,26.56095,29.48582,30.62138,27.74372],"xg_against_trend":[33.91013,26.88437,31.40046,33.31823,32.7465,36.93897],"goals_trend":[28,30,29,33,36,30],"goals_against_trend":[30,29,30,29,23,34]},{"team":"Fjölnir","short":"FJÖ","played":7,"wins":2,"draws":1,"losses":4,"goals_for":191,"goals_against":186,"goal_diff":5,"points":5,"xg_for":160.66048,"xg_against":156.89222,"xpts":5.70525,"goals_for_predicted":149,"goals_against_predicted":147,"points_predicted":3,"n_predicted_matches":5,"n_played_matches":7,"rank":8,"form":["L","D","L","W","L"],"xg_trend":[32.47199,32.35691,33.31823,31.92796,30.58539],"xg_against_trend":[30.44679,30.82561,29.48582,29.205,36.929],"goals_trend":[30,31,29,36,23],"goals_against_trend":[31,31,33,19,33]},{"team":"Víkingur 2","short":"VÍK","played":7,"wins":1,"draws":1,"losses":5,"goals_for":210,"goals_against":239,"goal_diff":-29,"points":3,"xg_for":177.44055,"xg_against":189.35043,"xpts":4.25125,"goals_for_predicted":179,"goals_against_predicted":208,"points_predicted":2,"n_predicted_matches":6,"n_played_matches":7,"rank":9,"form":["L","W","L","L","L"],"xg_trend":[36.36303,24.01309,31.40046,26.14252,28.58059,30.94085],"xg_against_trend":[26.66883,32.0937,26.56095,31.37776,34.73607,37.91312],"goals_trend":[19,30,30,30,32,38],"goals_against_trend":[33,34,29,31,41,40]},{"team":"Fram 2","short":"FRA","played":7,"wins":1,"draws":1,"losses":5,"goals_for":183,"goals_against":219,"goal_diff":-36,"points":3,"xg_for":150.85507,"xg_against":165.87582,"xpts":3.2635,"goals_for_predicted":127,"goals_against_predicted":159,"points_predicted":2,"n_predicted_matches":5,"n_played_matches":7,"rank":10,"form":["L","L","L","L","L"],"xg_trend":[30.44679,29.94724,29.28226,28.43227,32.7465],"xg_against_trend":[32.47199,30.39026,37.63554,34.75664,30.62138],"goals_trend":[31,22,24,27,23],"goals_against_trend":[30,27,38,28,36]},{"team":"Hvíti Riddarinn","short":"HVÍ","played":6,"wins":1,"draws":0,"losses":5,"goals_for":133,"goals_against":170,"goal_diff":-37,"points":2,"xg_for":111.94039,"xg_against":124.35503,"xpts":2.7135,"goals_for_predicted":106,"goals_against_predicted":128,"points_predicted":2,"n_predicted_matches":4,"n_played_matches":6,"rank":11,"form":["L","W","L","L","L"],"xg_trend":[28.26386,30.39026,25.72212,27.56414],"xg_against_trend":[33.64596,29.94724,34.65846,26.10338],"goals_trend":[30,27,21,28],"goals_against_trend":[32,22,36,38]},{"team":"Víðir","short":"VÍÐ","played":7,"wins":0,"draws":0,"losses":7,"goals_for":185,"goals_against":248,"goal_diff":-63,"points":0,"xg_for":174.46288,"xg_against":210.73018,"xpts":3.0615,"goals_for_predicted":163,"goals_against_predicted":205,"points_predicted":0,"n_predicted_matches":6,"n_played_matches":7,"rank":12,"form":["L","L","L","L","L"],"xg_trend":[32.40676,26.88437,30.17965,25.84752,35.05814,24.08645],"xg_against_trend":[29.20968,36.94895,31.25959,41.57761,36.15493,35.57942],"goals_trend":[30,29,32,22,26,24],"goals_against_trend":[34,30,33,43,36,29]}]}
