{"generated_at":"2026-10-29T12:13:23+0000","season":2026,"as_of":"2026-10-23","rows":[{"team":"Breiðablik","short":"BRE","played":23,"wins":17,"draws":1,"losses":5,"goals_for":64,"goals_against":29,"goal_diff":35,"points":52,"xg_for":26.35125,"xg_against":9.487,"xpts":18.401,"goals_for_predicted":27,"goals_against_predicted":10,"points_predicted":21,"n_predicted_matches":8,"n_played_matches":23,"rank":1,"form":["W","W","W","W","W"],"xg_trend":[3.292,5.57975,2.9875,3.1415,3.41125,2.39425,2.1675,3.3775],"xg_against_trend":[0.821,0.61575,1.2525,0.74125,1.1375,1.47025,1.433,2.01575],"goals_trend":[2,2,4,3,3,2,5,6],"goals_against_trend":[0,0,2,2,1,3,0,2]},{"team":"FH","short":"FH","played":23,"wins":13,"draws":4,"losses":6,"goals_for":66,"goals_against":45,"goal_diff":21,"points":43,"xg_for":19.38075,"xg_against":15.209,"xpts":14.8975,"goals_for_predicted":20,"goals_against_predicted":19,"points_predicted":16,"n_predicted_matches":9,"n_played_matches":23,"rank":2,"form":["W","L","W","L","L"],"xg_trend":[2.7025,1.56625,2.395,1.76825,2.38375,1.47025,2.6055,2.4735,2.01575],"xg_against_trend":[1.375,1.44475,0.9945,1.59875,1.69125,2.39425,0.57525,1.75775,3.3775],"goals_trend":[1,1,2,2,3,3,6,0,2],"goals_against_trend":[1,2,1,1,0,2,2,4,6]},{"team":"ÍBV","short":"ÍBV","played":23,"wins":10,"draws":3,"losses":10,"goals_for":39,"goals_against":46,"goal_diff":-7,"points":33,"xg_for":16.37,"xg_against":12.33925,"xpts":11.71225,"goals_for_predicted":12,"goals_against_predicted":11,"points_predicted":13,"n_predicted_matches":7,"n_played_matches":23,"rank":3,"form":["W","L","L","L","W"],"xg_trend":[2.87,1.93625,3.653,1.69125,2.48575,1.914,1.81975],"xg_against_trend":[1.487,1.97725,1.4745,2.38375,1.3605,2.13625,1.52],"goals_trend":[4,3,2,0,1,0,2],"goals_against_trend":[3,2,0,3,1,2,0]},{"team":"Þróttur R.","short":"ÞRÓ","played":23,"wins":9,"draws":5,"losses":9,"goals_for":43,"goals_against":39,"goal_diff":4,"points":32,"xg_for":15.53975,"xg_against":14.45925,"xpts":13.506,"goals_for_predicted":18,"goals_against_predicted":9,"points_predicted":18,"n_predicted_matches":9,"n_played_matches":23,"rank":4,"form":["L","W","L","W","W"],"xg_trend":[0.821,1.44475,1.7345,2.116,1.51325,2.20425,1.65125,1.75775,2.297],"xg_against_trend":[3.292,1.56625,1.276,0.90275,1.596,1.13275,1.28325,2.4735,0.93675],"goals_trend":[0,2,3,1,4,0,1,4,3],"goals_against_trend":[2,1,0,2,1,1,0,0,2]},{"team":"Grindavík/Njarðvík","short":"GRI","played":23,"wins":8,"draws":5,"losses":10,"goals_for":33,"goals_against":43,"goal_diff":-10,"points":29,"xg_for":10.80025,"xg_against":16.4145,"xpts":8.1345,"goals_for_predicted":10,"goals_against_predicted":16,"points_predicted":8,"n_predicted_matches":8,"n_played_matches":23,"rank":5,"form":["L","W","D","W","L"],"xg_trend":[0.89675,2.3005,0.9945,0.90275,1.9755,1.3605,1.433,0.93675],"xg_against_trend":[2.343,1.33675,2.395,2.116,1.2735,2.48575,2.1675,2.297],"goals_trend":[1,2,1,2,1,1,0,2],"goals_against_trend":[2,1,2,1,1,1,5,3]},{"team":"Stjarnan","short":"STJ","played":23,"wins":7,"draws":6,"losses":10,"goals_for":32,"goals_against":36,"goal_diff":-4,"points":27,"xg_for":12.7965,"xg_against":16.08825,"xpts":9.351,"goals_for_predicted":10,"goals_against_predicted":9,"points_predicted":11,"n_predicted_matches":8,"n_played_matches":23,"rank":6,"form":["L","L","D","L","L"],"xg_trend":[1.718,1.68425,1.733,1.59875,1.2735,1.13275,2.13625,1.52],"xg_against_trend":[2.882,1.74325,1.78125,1.76825,1.9755,2.20425,1.914,1.81975],"goals_trend":[1,2,2,1,1,1,2,0],"goals_against_trend":[2,0,2,2,1,0,0,2]},{"team":"Fram","short":"FRA","played":21,"wins":8,"draws":2,"losses":11,"goals_for":33,"goals_against":48,"goal_diff":-15,"points":26,"xg_for":8.389,"xg_against":18.9195,"xpts":5.5925,"goals_for_predicted":8,"goals_against_predicted":18,"points_predicted":4,"n_predicted_matches":7,"n_played_matches":21,"rank":7,"form":["W","W","D","W","L"],"xg_trend":[1.487,0.61575,1.276,1.80125,0.9055,1.72825,0.57525],"xg_against_trend":[2.87,5.57975,1.7345,2.46475,2.26525,1.39975,2.6055],"goals_trend":[3,0,0,0,0,3,2],"goals_against_trend":[4,2,3,1,0,2,6]},{"team":"Þór/KA","short":"ÞÓR","played":21,"wins":7,"draws":4,"losses":10,"goals_for":28,"goals_against":30,"goal_diff":-2,"points":25,"xg_for":10.17525,"xg_against":17.7155,"xpts":6.32825,"goals_for_predicted":11,"goals_against_predicted":19,"points_predicted":2,"n_predicted_matches":7,"n_played_matches":21,"rank":8,"form":["D","L","W","L","W"],"xg_trend":[1.375,1.33675,1.78125,1.4745,1.1375,1.39975,1.6705],"xg_against_trend":[2.7025,2.3005,1.733,3.653,3.41125,1.72825,2.187],"goals_trend":[1,1,2,0,1,2,4],"goals_against_trend":[1,2,2,2,3,3,6]},{"team":"Valur","short":"VAL","played":21,"wins":6,"draws":6,"losses":9,"goals_for":25,"goals_against":34,"goal_diff":-9,"points":24,"xg_for":11.94425,"xg_against":12.32575,"xpts":9.902,"goals_for_predicted":7,"goals_against_predicted":10,"points_predicted":7,"n_predicted_matches":7,"n_played_matches":21,"rank":9,"form":["D","W","L","D","W"],"xg_trend":[2.343,1.74325,1.97725,0.74125,2.26525,1.591,1.28325],"xg_against_trend":[0.89675,1.68425,1.93625,3.1415,0.9055,2.11025,1.65125],"goals_trend":[2,0,2,2,0,1,0],"goals_against_trend":[1,2,3,3,0,0,1]},{"team":"Víkingur R.","short":"VÍK","played":21,"wins":6,"draws":4,"losses":11,"goals_for":30,"goals_against":43,"goal_diff":-13,"points":22,"xg_for":12.4925,"xg_against":11.2815,"xpts":9.14,"goals_for_predicted":12,"goals_against_predicted":14,"points_predicted":9,"n_predicted_matches":6,"n_played_matches":21,"rank":10,"form":["W","W","D","D","L"],"xg_trend":[2.882,1.2525,2.46475,1.596,2.11025,2.187],"xg_against_trend":[1.718,2.9875,1.80125,1.51325,1.591,1.6705],"goals_trend":[2,2,1,1,0,6],"goals_against_trend":[1,4,0,4,1,4]}]}
