{"generated_at":"2026-10-20T23:17:07+0000","season":2026,"as_of":"2026-07-25","rows":[{"team":"Fjölnir","short":"FJÖ","played":11,"wins":9,"draws":1,"losses":1,"goals_for":56,"goals_against":10,"goal_diff":46,"points":28,"xg_for":13.087,"xg_against":6.33275,"xpts":8.56,"goals_for_predicted":21,"goals_against_predicted":3,"points_predicted":10,"n_predicted_matches":4,"n_played_matches":11,"rank":1,"form":["W","W","L","W","W"],"xg_trend":[3.62825,2.6815,4.1025,2.67475],"xg_against_trend":[1.44,1.635,1.73775,1.52],"goals_trend":[7,2,5,7],"goals_against_trend":[0,2,1,0]},{"team":"Einherji","short":"EIN","played":11,"wins":9,"draws":0,"losses":2,"goals_for":60,"goals_against":8,"goal_diff":52,"points":27,"xg_for":10.0785,"xg_against":8.76775,"xpts":6.4825,"goals_for_predicted":22,"goals_against_predicted":5,"points_predicted":9,"n_predicted_matches":4,"n_played_matches":11,"rank":2,"form":["W","W","W","L","W"],"xg_trend":[1.99025,3.20275,3.14775,1.73775],"xg_against_trend":[2.4105,0.621,1.63375,4.1025],"goals_trend":[3,14,4,1],"goals_against_trend":[0,0,0,5]},{"team":"Vestri","short":"VES","played":11,"wins":8,"draws":3,"losses":0,"goals_for":48,"goals_against":9,"goal_diff":39,"points":27,"xg_for":7.6315,"xg_against":10.53825,"xpts":4.765,"goals_for_predicted":14,"goals_against_predicted":3,"points_predicted":8,"n_predicted_matches":4,"n_played_matches":11,"rank":3,"form":["W","W","W","W","W"],"xg_trend":[3.936,1.29625,1.635,0.76425],"xg_against_trend":[0.29025,2.2335,2.6815,5.333],"goals_trend":[7,4,2,1],"goals_against_trend":[0,0,2,1]},{"team":"Fylkir","short":"FYL","played":11,"wins":8,"draws":2,"losses":1,"goals_for":71,"goals_against":8,"goal_diff":63,"points":26,"xg_for":14.8665,"xg_against":2.83025,"xpts":8.10075,"goals_for_predicted":12,"goals_against_predicted":2,"points_predicted":7,"n_predicted_matches":3,"n_played_matches":11,"rank":4,"form":["W","W","W","D","W"],"xg_trend":[3.4355,6.098,5.333],"xg_against_trend":[0.94375,1.12225,0.76425],"goals_trend":[5,6,1],"goals_against_trend":[1,0,1]},{"team":"Afturelding","short":"AFT","played":11,"wins":7,"draws":1,"losses":3,"goals_for":40,"goals_against":17,"goal_diff":23,"points":22,"xg_for":14.39275,"xg_against":2.234,"xpts":7.4775,"goals_for_predicted":19,"goals_against_predicted":1,"points_predicted":9,"n_predicted_matches":3,"n_played_matches":11,"rank":5,"form":["W","L","L","D","L"],"xg_trend":[2.29175,3.3875,8.7135],"xg_against_trend":[1.2935,0.80525,0.13525],"goals_trend":[5,3,11],"goals_against_trend":[1,0,0]},{"team":"Augnablik","short":"AUG","played":11,"wins":5,"draws":1,"losses":5,"goals_for":20,"goals_against":35,"goal_diff":-15,"points":16,"xg_for":8.0485,"xg_against":15.2715,"xpts":3.54775,"goals_for_predicted":7,"goals_against_predicted":15,"points_predicted":6,"n_predicted_matches":4,"n_played_matches":11,"rank":6,"form":["L","L","L","W","W"],"xg_trend":[1.44,1.12225,2.357,3.12925],"xg_against_trend":[3.62825,6.098,3.54225,2.003],"goals_trend":[0,0,2,5],"goals_against_trend":[7,6,1,1]},{"team":"Dalvík/Reynir","short":"DAL","played":11,"wins":4,"draws":2,"losses":5,"goals_for":20,"goals_against":33,"goal_diff":-13,"points":14,"xg_for":11.03775,"xg_against":9.31775,"xpts":6.138,"goals_for_predicted":8,"goals_against_predicted":13,"points_predicted":4,"n_predicted_matches":4,"n_played_matches":11,"rank":7,"form":["L","W","W","W","L"],"xg_trend":[0.94375,4.273,3.818,2.003],"xg_against_trend":[3.4355,1.506,1.247,3.12925],"goals_trend":[1,2,4,1],"goals_against_trend":[5,2,1,5]},{"team":"KÞ","short":"KÞ","played":11,"wins":4,"draws":1,"losses":6,"goals_for":23,"goals_against":41,"goal_diff":-18,"points":13,"xg_for":8.787,"xg_against":12.75775,"xpts":4.27,"goals_for_predicted":6,"goals_against_predicted":9,"points_predicted":4,"n_predicted_matches":4,"n_played_matches":11,"rank":8,"form":["W","W","W","L","L"],"xg_trend":[1.2935,1.506,2.44525,3.54225],"xg_against_trend":[2.29175,4.273,3.836,2.357],"goals_trend":[1,2,2,1],"goals_against_trend":[5,2,0,2]},{"team":"KFR","short":"KFR","played":11,"wins":2,"draws":2,"losses":7,"goals_for":12,"goals_against":54,"goal_diff":-42,"points":8,"xg_for":5.083,"xg_against":6.26325,"xpts":2.34175,"goals_for_predicted":1,"goals_against_predicted":6,"points_predicted":0,"n_predicted_matches":2,"n_played_matches":11,"rank":9,"form":["L","L","W","W","D"],"xg_trend":[5.083],"xg_against_trend":[6.26325],"goals_trend":[1],"goals_against_trend":[6]},{"team":"ÍR","short":"ÍR","played":11,"wins":1,"draws":2,"losses":8,"goals_for":13,"goals_against":31,"goal_diff":-18,"points":5,"xg_for":5.37925,"xg_against":5.851,"xpts":4.12525,"goals_for_predicted":1,"goals_against_predicted":9,"points_predicted":1,"n_predicted_matches":3,"n_played_matches":11,"rank":10,"form":["L","L","L","L","D"],"xg_trend":[2.2335,1.63375,1.512],"xg_against_trend":[1.29625,3.14775,1.407],"goals_trend":[0,0,1],"goals_against_trend":[4,4,1]},{"team":"Álftanes","short":"ÁLF","played":11,"wins":0,"draws":2,"losses":9,"goals_for":6,"goals_against":42,"goal_diff":-36,"points":2,"xg_for":12.3975,"xg_against":9.8245,"xpts":7.0305,"goals_for_predicted":3,"goals_against_predicted":16,"points_predicted":2,"n_predicted_matches":5,"n_played_matches":11,"rank":11,"form":["L","L","L","L","L"],"xg_trend":[2.4105,0.80525,6.25475,1.407,1.52],"xg_against_trend":[1.99025,3.3875,0.26,1.512,2.67475],"goals_trend":[0,0,2,1,0],"goals_against_trend":[3,3,2,1,7]},{"team":"Smári","short":"SMÁ","played":11,"wins":0,"draws":1,"losses":10,"goals_for":9,"goals_against":90,"goal_diff":-81,"points":1,"xg_for":1.3065,"xg_against":22.107,"xpts":0.38575,"goals_for_predicted":2,"goals_against_predicted":34,"points_predicted":1,"n_predicted_matches":4,"n_played_matches":11,"rank":12,"form":["L","L","L","L","L"],"xg_trend":[0.29025,0.621,0.26,0.13525],"xg_against_trend":[3.936,3.20275,6.25475,8.7135],"goals_trend":[0,0,2,0],"goals_against_trend":[7,14,2,11]}]}
